{
  "id": "basic-first-aid",
  "name": "Basic First Aid",
  "version": "1.0.0",
  "description": "Checklists and step-by-steps for common first aid.",
  "domain": "first_aid",
  "scope": {
    "in_scope": ["bleeding control", "minor burns", "choking (adult/child)"],
    "out_of_scope": ["drug dosing", "diagnosis", "advanced procedures"]
  },
  "languages": ["en", "hi"],
  "reading_level": "simple",
  "interaction": { "supports_voice": true, "qna_style": "steps" },
  "safety": {
    "refusals": {
      "mode": "substring",
      "rules": [
        { "trigger": "diagnose|prescribe|dose|medication", "response": "I canâ€™t provide diagnoses or medication dosing. For medicines, consult a clinician." },
        { "trigger": "surgery|stitch", "response": "Procedures must be done by trained clinicians. Seek medical help." }
      ]
    },
    "escalation_rules": [
      { "condition": "Bleeding uncontrolled after 10 minutes of firm pressure", "message": "Seek urgent medical help now." },
      { "condition": "Burn larger than palm, electrical/chemical burn", "message": "Seek urgent medical help now." }
    ],
    "legal_disclaimer": "Educational guidance only; not a substitute for professional care."
  },
  "sources": [
    { "title": "First Aid Guidelines", "publisher": "WHO", "year": 2016, "type": "guideline", "url": "" },
    { "title": "First Aid Manual", "publisher": "Red Cross/Red Crescent", "year": 2021, "type": "guideline", "url": "" }
  ],
  "content_map": {
    "index": { "en": "locale/en/index.md", "hi": "locale/hi/index.md" },
    "topics/bleeding": { "en": "locale/en/topics/bleeding.md" },
    "topics/burns": { "en": "locale/en/topics/burns.md", "hi": "locale/hi/topics/burns.md" },
    "topics/choking": { "en": "locale/en/topics/choking.md" },
    "glossary": { "en": "locale/en/glossary.yaml" }
  },
  "compat": {
    "model_min": "gpt-oss:20b",
    "quantization": ["int4", "int8"],
    "app_version_min": "0.3.0"
  },
  "packaging": {
    "created_utc": "2025-08-20T00:00:00Z",
    "content_bytes": 0,
    "sha256": "REPLACE_WITH_ZIP_HASH"
  },
  "maintainers": [
    { "name": "Offline AI Kiosk Team", "email": "team@example.org", "org": "OAK", "role": "publisher" }
  ],
  "audit": {
    "medical_reviewer": "TBD",
    "last_review_utc": "2025-08-20T00:00:00Z",
    "change_notes": "Initial release."
  },
  "license": "CC-BY-4.0",
  "region_tags": ["SA-General", "IN-General"]
}
